{"$schema":"https://json-schema.org/draft/2020-12/schema","$id":"https://hoy.local/contracts/lifestyle-catalog-index-v1.schema.json","title":"HOY Lifestyle Catalog Index v1","type":"object","required":["contractVersion","generatedAt","region","recordCount","chunks"],"properties":{"contractVersion":{"const":"1.0.0"},"generatedAt":{"type":"string"},"recordCount":{"const":101},"region":{"type":"object","required":["id","name","countryCode","timezone","currency"],"properties":{"id":{"type":"string","minLength":1},"name":{"type":"string","minLength":1},"countryCode":{"type":"string","pattern":"^[A-Z]{2}$"},"timezone":{"type":"string","minLength":1},"currency":{"type":"string","pattern":"^[A-Z]{3}$"}},"additionalProperties":false},"chunks":{"type":"array","minItems":1,"items":{"type":"string","pattern":"^\\./data/catalog/lifestyle-[0-9]{3}-[0-9]{3}\\.json$"}}},"additionalProperties":false}
